{
  "id": "art_5566778899aabbccddeeff0011223344",
  "project_id": "proj_9f8e7d6c5b4a39281706f5e4d3c2b1a0",
  "run_id": "run_1a2b3c4d5e6f708192a3b4c5d6e7f809",
  "kind": "figure",
  "uri": "local://artifacts/art_5566778899aabbccddeeff0011223344/residuals.svg",
  "sha256": "0f1e2d3c4b5a69788796a5b4c3d2e1f00f1e2d3c4b5a69788796a5b4c3d2e1f0",
  "size_bytes": 48213,
  "media_type": "image/svg+xml",
  "producer_step_id": "step_0123456789abcdef0123456789abcdef",
  "inputs": ["art_66778899aabbccddeeff001122334455"],
  "status": "READY",
  "created_at": "2026-08-04T08:07:00Z"
}
